{
  "$schema": "./tokens.schema.json",
  "version": "1.0.0",
  "_comment": "Semantic char-set tier. Names describe USE not APPEARANCE (D8). Validator (scripts/validate-tokens.sh) enforces every glyph appears in primitives.json.",

  "sets": {
    "default": {
      "intent": "Standard prose; the default unless another intent applies.",
      "corner":   { "tl": "┌", "tr": "┐", "bl": "└", "br": "┘" },
      "edge":     { "h": "─", "v": "│" },
      "junction": { "tee_d": "┬", "tee_u": "┴", "tee_r": "├", "tee_l": "┤", "cross": "┼" }
    },
    "emphasis": {
      "intent": "Headers, focus blocks, draw-the-eye framing.",
      "corner":   { "tl": "┏", "tr": "┓", "bl": "┗", "br": "┛" },
      "edge":     { "h": "━", "v": "┃" },
      "junction": { "tee_d": "┳", "tee_u": "┻", "tee_r": "┣", "tee_l": "┫", "cross": "╋" }
    },
    "title": {
      "intent": "Document titles only; reserved for §0-style banners.",
      "corner":   { "tl": "╔", "tr": "╗", "bl": "╚", "br": "╝" },
      "edge":     { "h": "═", "v": "║" },
      "junction": { "tee_d": "╦", "tee_u": "╩", "tee_r": "╠", "tee_l": "╣", "cross": "╬" }
    },
    "soft": {
      "intent": "Status cards, ambient UI, diff blocks.",
      "corner":   { "tl": "╭", "tr": "╮", "bl": "╰", "br": "╯" },
      "edge":     { "h": "─", "v": "│" },
      "junction": { "tee_d": "┬", "tee_u": "┴", "tee_r": "├", "tee_l": "┤", "cross": "┼" }
    },
    "portable": {
      "intent": "Renders anywhere (NO_COLOR, CI logs, bare TTYs, screen-readers).",
      "corner":   { "tl": "+", "tr": "+", "bl": "+", "br": "+" },
      "edge":     { "h": "-", "v": "|" },
      "junction": { "tee_d": "+", "tee_u": "+", "tee_r": "+", "tee_l": "+", "cross": "+" }
    }
  },

  "arrows": {
    "default":  { "right": "→",  "left": "←",  "up": "↑", "down": "↓" },
    "portable": { "right": "->", "left": "<-", "up": "^", "down": "v" }
  },

  "fills": {
    "high":   "▓",
    "med":    "▒",
    "low":    "░",
    "full":   "█",
    "empty":  " ",
    "bars":   ["▏", "▎", "▍", "▌", "▋", "▊", "▉", "█"]
  },

  "density_overrides": {
    "_comment": "Per-pattern density floor. Default threshold (§A.5) is 0.20.",
    "progress-bar": 0.10,
    "sparkline":    0.10,
    "blast-radius": 0.15
  }
}
